{
  "version": "1.0",
  "run_id": "2026-09-18T03-46-29.835Z-192ac4b9",
  "started_at": "2026-09-18T03:46:29.835Z",
  "finished_at": "2026-09-18T03:46:29.850Z",
  "duration_ms": 15,
  "overall_passed": true,
  "provider": {
    "type": "deterministic",
    "degraded": false,
    "detail": "offline-fixture"
  },
  "gates": [
    {
      "id": "req-spec",
      "stage": "requirements",
      "required": true,
      "passed": true,
      "humanGate": null,
      "blockers": [],
      "checks": [
        {
          "id": "req-doc-exists",
          "type": "file_exists",
          "passed": true,
          "severity": "high",
          "evidence": [
            {
              "path": "docs/00-requirements.md",
              "kind": "file",
              "excerpt": "sha256:8c7c12b3e0ba40d695ca873f36fb1dbaab6b32c3367008a812bf475c54cc0c07"
            },
            {
              "path": "docs/00-requirements.md",
              "kind": "file",
              "excerpt": "matchedFiles=1 minCount=1"
            }
          ]
        },
        {
          "id": "req-ids-present",
          "type": "regex",
          "passed": true,
          "severity": "medium",
          "evidence": [
            {
              "path": "docs/00-requirements.md",
              "kind": "file",
              "excerpt": "33 match(es); L44:REQ-QUALITY-GATE-016 | L53:REQ-QUALITY-GATE-001 | L61:REQ-QUALITY-GATE-002"
            },
            {
              "path": "docs/00-requirements.md",
              "kind": "json_pointer",
              "excerpt": "pattern=REQ-QUALITY-GATE-\\d{3} mode=count countMode=unique totalMatches=33 uniqueMatches=16 minMatches=16"
            }
          ]
        },
        {
          "id": "req-index-valid",
          "type": "json_assert",
          "passed": true,
          "severity": "high",
          "evidence": [
            {
              "path": "docs/requirements-index.json",
              "kind": "json_pointer",
              "excerpt": "/requirements -> exists=true expected=true"
            },
            {
              "path": "docs/requirements-index.json",
              "kind": "json_pointer",
              "excerpt": "/requirements/0/id -> matches=/^REQ-QUALITY-GATE-\\d{3}$/ against REQ-QUALITY-GATE-001"
            },
            {
              "path": "docs/requirements-index.json",
              "kind": "json_pointer",
              "excerpt": "/schemaVersion -> equals=\"1.0\" expected=\"1.0\""
            }
          ]
        },
        {
          "id": "interface-fields",
          "type": "regex",
          "passed": true,
          "severity": "high",
          "evidence": [
            {
              "path": "docs/01-architecture.md",
              "kind": "file",
              "excerpt": "66 match(es); L68:humanGate | L68:approvalRecord | L68:enforcement"
            },
            {
              "path": "docs/01-architecture.md",
              "kind": "json_pointer",
              "excerpt": "pattern=humanGate|approvalRecord|enforcement mode=count countMode=unique totalMatches=66 uniqueMatches=3 minMatches=3"
            }
          ]
        }
      ]
    }
  ]
}
