{
  "version": "1.0",
  "run_id": "2026-09-17T20-29-26.044Z-8a1da55b",
  "started_at": "2026-09-17T20:29:26.044Z",
  "finished_at": "2026-09-17T20:29:26.058Z",
  "duration_ms": 14,
  "overall_passed": true,
  "provider": {
    "type": "deterministic",
    "degraded": false,
    "detail": "offline-fixture"
  },
  "gates": [
    {
      "id": "req-spec",
      "stage": "requirements",
      "required": true,
      "passed": true,
      "humanGate": {
        "role": "product",
        "approvalRecord": ".qgate/approvals/req-to-design/approval.json",
        "approvalState": "approved",
        "approvedBy": "product-owner",
        "approvedAt": "2026-05-04T09:00:00Z"
      },
      "blockers": [],
      "checks": [
        {
          "id": "req-doc-exists",
          "type": "file_exists",
          "passed": true,
          "severity": "high",
          "evidence": [
            {
              "path": "REQUIREMENTS.md",
              "kind": "file",
              "excerpt": "sha256:25415ce90c074379226e6562183820637782fff5d337b21133ca25ae7f0de97e"
            },
            {
              "path": "REQUIREMENTS.md",
              "kind": "file",
              "excerpt": "matchedFiles=1 minCount=1"
            }
          ]
        },
        {
          "id": "req-ids-present",
          "type": "regex",
          "passed": true,
          "severity": "high",
          "evidence": [
            {
              "path": "REQUIREMENTS.md",
              "kind": "file",
              "excerpt": "7 match(es); L9:REQ-DEMO-001 | L18:REQ-DEMO-002 | L24:REQ-DEMO-002"
            },
            {
              "path": "REQUIREMENTS.md",
              "kind": "json_pointer",
              "excerpt": "pattern=REQ-DEMO-\\d{3} mode=count countMode=unique totalMatches=7 uniqueMatches=6 minMatches=4"
            }
          ]
        },
        {
          "id": "req-index-valid",
          "type": "json_assert",
          "passed": true,
          "severity": "high",
          "evidence": [
            {
              "path": ".qgate/requirements-index.json",
              "kind": "json_pointer",
              "excerpt": "/requirements -> exists=true expected=true"
            },
            {
              "path": ".qgate/requirements-index.json",
              "kind": "json_pointer",
              "excerpt": "/requirements/0/id -> matches=/^REQ-DEMO-\\d{3}$/ against REQ-DEMO-001"
            },
            {
              "path": ".qgate/requirements-index.json",
              "kind": "json_pointer",
              "excerpt": "/schemaVersion -> equals=\"1.0\" expected=\"1.0\""
            }
          ]
        }
      ]
    },
    {
      "id": "interface-frozen",
      "stage": "design",
      "required": true,
      "passed": true,
      "humanGate": {
        "role": "architect",
        "approvalRecord": ".qgate/approvals/design-to-build/approval.json",
        "approvalState": "approved",
        "approvedBy": "architect",
        "approvedAt": "2026-05-04T09:30:00Z"
      },
      "blockers": [],
      "checks": [
        {
          "id": "interface-exists",
          "type": "file_exists",
          "passed": true,
          "severity": "high",
          "evidence": [
            {
              "path": "openapi.yaml",
              "kind": "file",
              "excerpt": "sha256:7cc4b41e02ad00156c8c73d3cc125268e5bd8114f2dd8f25c59dfe521bf6d304"
            },
            {
              "path": "openapi.yaml",
              "kind": "file",
              "excerpt": "matchedFiles=1 minCount=1"
            }
          ]
        },
        {
          "id": "interface-fields",
          "type": "regex",
          "passed": true,
          "severity": "high",
          "evidence": [
            {
              "path": "openapi.yaml",
              "kind": "file",
              "excerpt": "21 match(es); L16:Idempotency-Key | L45:requestId | L67:requestId"
            },
            {
              "path": "openapi.yaml",
              "kind": "json_pointer",
              "excerpt": "pattern=requestId|traceId|amount|currency|Idempotency-Key mode=count countMode=unique totalMatches=21 uniqueMatches=5 minMatches=5"
            }
          ]
        },
        {
          "id": "rule-file-exists",
          "type": "file_exists",
          "passed": true,
          "severity": "high",
          "evidence": [
            {
              "path": ".opencodereview/rule.json",
              "kind": "file",
              "excerpt": "sha256:6b87a10152676f539d283c9940dd20f98a276a39e31f06ff2a562bee92a84f2f"
            },
            {
              "path": ".opencodereview/rule.json",
              "kind": "file",
              "excerpt": "matchedFiles=1 minCount=1"
            }
          ]
        },
        {
          "id": "no-loose-ends",
          "type": "file_not_exists",
          "passed": true,
          "severity": "medium",
          "evidence": [
            {
              "path": "qgate.config.json",
              "kind": "json_pointer",
              "excerpt": "TODO.md matched 0 file(s), allowed 0"
            }
          ]
        }
      ]
    }
  ]
}
