{
  "version": "1.0",
  "run_id": "2026-09-18T03-00-53.717Z-e998369c",
  "started_at": "2026-09-18T03:00:53.717Z",
  "finished_at": "2026-09-18T03:00:53.766Z",
  "duration_ms": 49,
  "overall_passed": true,
  "provider": {
    "type": "deterministic",
    "degraded": false,
    "detail": "offline-fixture"
  },
  "gates": [
    {
      "id": "req-spec",
      "stage": "requirements",
      "required": true,
      "passed": true,
      "humanGate": null,
      "blockers": [],
      "checks": [
        {
          "id": "req-doc-exists",
          "type": "file_exists",
          "passed": true,
          "severity": "high",
          "evidence": [
            {
              "path": "docs/00-requirements.md",
              "kind": "file",
              "excerpt": "sha256:8c7c12b3e0ba40d695ca873f36fb1dbaab6b32c3367008a812bf475c54cc0c07"
            },
            {
              "path": "docs/00-requirements.md",
              "kind": "file",
              "excerpt": "matchedFiles=1 minCount=1"
            }
          ]
        },
        {
          "id": "req-ids-present",
          "type": "regex",
          "passed": true,
          "severity": "medium",
          "evidence": [
            {
              "path": "docs/00-requirements.md",
              "kind": "file",
              "excerpt": "33 match(es); L44:REQ-QUALITY-GATE-016 | L53:REQ-QUALITY-GATE-001 | L61:REQ-QUALITY-GATE-002"
            },
            {
              "path": "docs/00-requirements.md",
              "kind": "json_pointer",
              "excerpt": "pattern=REQ-QUALITY-GATE-\\d{3} mode=count countMode=unique totalMatches=33 uniqueMatches=16 minMatches=16"
            }
          ]
        },
        {
          "id": "req-index-valid",
          "type": "json_assert",
          "passed": true,
          "severity": "high",
          "evidence": [
            {
              "path": "docs/requirements-index.json",
              "kind": "json_pointer",
              "excerpt": "/requirements -> exists=true expected=true"
            },
            {
              "path": "docs/requirements-index.json",
              "kind": "json_pointer",
              "excerpt": "/requirements/0/id -> matches=/^REQ-QUALITY-GATE-\\d{3}$/ against REQ-QUALITY-GATE-001"
            },
            {
              "path": "docs/requirements-index.json",
              "kind": "json_pointer",
              "excerpt": "/schemaVersion -> equals=\"1.0\" expected=\"1.0\""
            }
          ]
        },
        {
          "id": "interface-fields",
          "type": "regex",
          "passed": true,
          "severity": "high",
          "evidence": [
            {
              "path": "docs/01-architecture.md",
              "kind": "file",
              "excerpt": "66 match(es); L68:humanGate | L68:approvalRecord | L68:enforcement"
            },
            {
              "path": "docs/01-architecture.md",
              "kind": "json_pointer",
              "excerpt": "pattern=humanGate|approvalRecord|enforcement mode=count countMode=unique totalMatches=66 uniqueMatches=3 minMatches=3"
            }
          ]
        }
      ]
    },
    {
      "id": "interface-frozen",
      "stage": "design",
      "required": true,
      "passed": true,
      "humanGate": null,
      "blockers": [],
      "checks": [
        {
          "id": "contract-doc-exists",
          "type": "file_exists",
          "passed": true,
          "severity": "high",
          "evidence": [
            {
              "path": "docs/01-architecture.md",
              "kind": "file",
              "excerpt": "sha256:edf995c5c7d4c4c7578a2d4880d971d234b17609b4f6d5dccb43d401c4b53035"
            },
            {
              "path": "docs/01-architecture.md",
              "kind": "file",
              "excerpt": "matchedFiles=1 minCount=1"
            }
          ]
        },
        {
          "id": "contract-fields-present",
          "type": "regex",
          "passed": true,
          "severity": "medium",
          "evidence": [
            {
              "path": "docs/01-architecture.md",
              "kind": "file",
              "excerpt": "102 match(es); L47:overall_passed | L68:humanGate | L76:humanGate"
            },
            {
              "path": "docs/01-architecture.md",
              "kind": "json_pointer",
              "excerpt": "pattern=requirementId|overall_passed|json_assert|trace_matrix|humanGate mode=count countMode=unique totalMatches=102 uniqueMatches=5 minMatches=5"
            }
          ]
        },
        {
          "id": "schemas-exist",
          "type": "file_exists",
          "passed": true,
          "severity": "high",
          "evidence": [
            {
              "path": "schemas/config.schema.json",
              "kind": "file",
              "excerpt": "sha256:9816402baa7286f705d8fd61f62aeb4e0612dc218f8c8147ee464da985346c39"
            },
            {
              "path": "schemas/evidence-ledger.schema.json",
              "kind": "file",
              "excerpt": "sha256:97658d8aaac123749f87304a82e93da802c96dae916bcebe0da8b0d31dab4e35"
            },
            {
              "path": "schemas/run-result.schema.json",
              "kind": "file",
              "excerpt": "sha256:74e1807d372ecb00af16ad6dd73803e805dce96e575db8426018ae9a93482ae5"
            },
            {
              "path": "schemas/trace-matrix.schema.json",
              "kind": "file",
              "excerpt": "sha256:107113bb0588a32d9881f9de0e60e9b27a87905c8a7cf8d117aef91e8a7b070d"
            },
            {
              "path": "schemas/config.schema.json",
              "kind": "file",
              "excerpt": "matchedFiles=4 minCount=4"
            }
          ]
        },
        {
          "id": "no-loose-ends",
          "type": "file_not_exists",
          "passed": true,
          "severity": "medium",
          "evidence": [
            {
              "path": "qgate.config.json",
              "kind": "json_pointer",
              "excerpt": "docs/TODO.md matched 0 file(s), allowed 0"
            }
          ]
        }
      ]
    }
  ]
}
